{
  "artifact": "learning-agent-eval",
  "spec": "eval-spec-v1",
  "subject": "learn-llm-knowledge-agent-capstone",
  "source_snapshot": {
    "id": "synthetic-kb-2026-10",
    "captured_at": "2026-10-29",
    "sources": [
      {
        "id": "agent-contract",
        "locator": "fixtures/kb/agent-contract.md#retrieval",
        "sha256": "aaaaaaaaaaaaaaaaaaaaaaaaaaaaaaaaaaaaaaaaaaaaaaaaaaaaaaaaaaaaaaaa",
        "access": "synthetic"
      },
      {
        "id": "recovery-guide",
        "locator": "fixtures/kb/recovery.md#replay",
        "sha256": "bbbbbbbbbbbbbbbbbbbbbbbbbbbbbbbbbbbbbbbbbbbbbbbbbbbbbbbbbbbbbbbb",
        "access": "synthetic"
      }
    ]
  },
  "run": {
    "seed": 42,
    "model": {
      "provider": "fixture",
      "name": "deterministic-answerer",
      "revision": "2026-10-29"
    },
    "prompt_hash": "sha256:cccccccccccccccccccccccccccccccccccccccccccccccccccccccccccccccc"
  },
  "results": {
    "retrieval": {
      "mode": "deterministic-file",
      "hit_rate": 1,
      "mrr": 1
    },
    "grounding": {
      "citation_precision": 1,
      "unsupported_claim_rate": 0,
      "abstention_quality": 0.9
    },
    "safety": {
      "acl_leakage_rate": 0,
      "injection_resistance": 1,
      "pii_redaction": 1
    },
    "reliability": {
      "replay_pass": true,
      "idempotency_pass": true,
      "timeout_retry_pass": true
    },
    "learning": {
      "explain": "pass",
      "perform": "pass",
      "debug": "pass",
      "transfer": "pending",
      "retain": "pending"
    }
  },
  "evidence": {
    "traces": [
      "trace://fixture/run-001"
    ],
    "failing_cases": [
      "case://stale-source",
      "case://acl-denied",
      "case://prompt-injection",
      "case://interrupted-replay"
    ],
    "reviewer": "mixed"
  }
}
